{
  "implementation_id": "a5b6c7d8-e9f0-4102-c3d4-e5f6a7b8c9d0",
  "modality": "ai-conversational",
  "schema_version": "4.0",
  "content": {
    "title": "Sex-Based Hostile Work Environment: The Renee Scenario",
    "narrative": "You’ve been working alongside Renee for about eight months. She’s a project analyst on a mostly male engineering and finance team—sharp, organized, and highly capable. But lately, she hasn’t seemed like herself.\n\nIt started with Greg, the team lead. He greets Renee as \"our office mom\" and \"kiddo.\" In meetings, he asks the guys to \"double-check Renee’s numbers\"—even when she’s right—and once joked that she was hired \"to help our diversity stats.\" When she pushed back, he brushed it off: \"Relax, it’s a joke. You’re too sensitive.\" Renee tried to let it go. As one of the only women on the team, she figured some of this came with the territory and didn’t want to make it an issue.\n\nThen there’s Mark, a colleague. He talks over Renee in meetings and presents her ideas as his own. There’s a steady stream of comments like, \"You clean up nice\" and \"Date-night outfit?\" Somehow, note-taking and lunch runs always fall to her. What started as occasional comments became almost daily. The jokes get a few laughs, and everyone moves on—but Renee doesn’t. She carries them with her.\n\nWhat Renee didn’t know, at least at first, was that the team chat had become another place where she was the punchline. Every time she spoke up, someone posted a cupcake emoji or \"mom of the year\" GIF. A separate thread described her as \"difficult\" and someone who \"can’t take a joke.\" Eventually, someone showed her the messages.\n\nShe was prepared to ignore it all until Greg told a client, \"Let the guys handle the technical part.\" Suddenly, the pattern wasn’t just affecting how her coworkers saw her—it was undermining her credibility with people outside the team.\n\nNow Renee has grown quieter. She keeps her head down, avoids lingering after meetings, and speaks up less often. You’ve just become aware of what’s been happening, and you’re left wondering what you should do next.",
    "scene_world": {
      "setting": "An office workplace — a mostly-male engineering and finance team, where Renee is a project analyst eight months into the job.",
      "canon": {
        "facts": [
          "Greg, the team lead, greets Renee as 'our office mom' and 'kiddo,' and asks the guys to double-check Renee's numbers even when she's right.",
          "Greg once joked that Renee was hired 'to help our diversity stats,' and when she pushed back, told her to 'relax, you're too sensitive.'",
          "Mark, a peer, talks over Renee in meetings, re-presents her ideas as his own, and makes a steady stream of comments on her appearance.",
          "Note-taking and lunch runs default to Renee by habit.",
          "The team chat has a running 'bit' at Renee's expense — a cupcake or 'mom of the year' reaction every time she speaks up, and a separate thread calling her 'difficult' and someone who 'can't take a joke.'",
          "Greg told a client to 'let the guys handle the technical part,' undercutting Renee's credibility in front of an outsider.",
          "Renee has grown quieter since these events — she keeps her head down, avoids lingering after meetings, and speaks up less often.",
          "The learner is a co-worker who has just become aware of what's been happening."
        ]
      },
      "characters": [
        {
          "id": "greg",
          "name": "Greg",
          "role": "The team lead, who frames Renee as the team's 'office mom' and 'kiddo' and routinely has the team double-check her numbers.",
          "behavior": {
            "baseline": "Holding court — casual and confident, playing to the room.",
            "driver": "Takes his cue from the room. Laughter is license to keep going; a line held firmly makes him retreat behind 'it was a joke.'",
            "guardrails": [
              "Never physically aggressive.",
              "Tries to save face before he backs down — 'I guess people can't take a joke these days.'",
              "Never fully concedes he was wrong; he puts up some resistance even when the callout lands."
            ]
          }
        },
        {
          "id": "renee",
          "name": "Renee",
          "role": "Project analyst, eight months in — the person the conduct is aimed at.",
          "behavior": {
            "baseline": "Quieter than she used to be. A tight smile, eyes down, absorbing it and moving on.",
            "driver": "Reads whether anyone else in the room signals that the conduct isn't acceptable.",
            "guardrails": [
              "Doesn't confront Greg herself — she had already decided to let this go.",
              "Her reactions stay understated: a glance, a tight smile, a few words of subdued thanks."
            ]
          }
        },
        {
          "id": "mark",
          "name": "Mark",
          "role": "A peer on the team who talks over Renee and re-presents her ideas as his own.",
          "behavior": {
            "baseline": "Along for the joke — laughs first, follows Greg's lead.",
            "driver": "Mirrors the room. He piles on while others are laughing and goes quiet when they do.",
            "guardrails": [
              "Never the instigator — he amplifies, he doesn't start it."
            ]
          }
        }
      ]
    },
    "coach_persona": "Precise, grounded in employment law, never clinical.",
    "tone_guidelines": [
      "The legal question has a right answer — deliver it clearly, don't hedge.",
      "The empathy phase is human-centered — shift to it without losing accuracy.",
      "Never shame a bystander instinct — redirect with curiosity and specificity.",
      "End every response with a question or a forward pivot."
    ],
    "teaching_points": [
      {
        "topic": "The law",
        "points": [
          "Sex-based conduct is harassment under Title VII even when it isn't sexual and there's no quid pro quo — demeaning someone because of sex counts.",
          "The hostile work environment standard is met by pervasive, sex-based conduct that makes the workplace intimidating or abusive, judged on the totality of the circumstances — and it affects everyone in that environment, not only the primary target.",
          "Intent doesn't determine harassment — the test is impact and context, not whether the harasser meant it as a joke.",
          "No psychological injury need be shown — the test is whether a reasonable person would find the environment hostile; 'just jokes' is never an accurate frame."
        ]
      },
      {
        "topic": "The impact",
        "points": [
          "Sustained, daily conduct wears a person down and can affect entire teams, not only the person targeted.",
          "Being quietly managed down during a critical eight-month credibility-building window affects professional trajectory and willingness to advocate for oneself.",
          "Left unchallenged, harassment shapes what feels normal for everyone in the environment, resetting who feels safe to speak up."
        ]
      },
      {
        "topic": "Reporting",
        "points": [
          "As a witness, you now have knowledge of conduct that likely violates policy and law — that shapes what you're responsible for doing next.",
          "Renee's own reporting is something a witness can encourage and support, not something to carry for her.",
          "Review your organization's harassment policy — it may define specific obligations for employees who witness harassment."
        ]
      },
      {
        "topic": "The bystander framework",
        "points": [
          "Pick an Action: bystanders can redirect a conversation, give an audible signal, or call conduct out directly — direct confrontation is one option, not the only one.",
          "Offer Support: check in with the targeted person privately.",
          "Consider Escalating: review your organization's harassment policy, which may define specific obligations for witnesses."
        ]
      }
    ],
    "misconceptions": [
      {
        "misconception": "'It's not sexual, so it's not harassment'",
        "redirect": "The most common misconception — sex-based conduct qualifies under Title VII even when nothing sexual is said."
      },
      {
        "misconception": "'It's just joking / workplace banter'",
        "redirect": "Minimizes the cumulative weight of the conduct — the real question is what daily degradation actually costs someone, not whether it was meant as a joke."
      },
      {
        "misconception": "'Not my place to get involved'",
        "redirect": "Classic bystander non-intervention — silence is never neutral, it signals acceptance, and others are likely as concerned as the learner and will support taking action."
      },
      {
        "misconception": "'It only counts if it affects their job'",
        "redirect": "Misapplies the standard — a hostile work environment qualifies without economic or psychological injury."
      }
    ],
    "opening": {
      "id": "opening_reflection",
      "label": "Opening Reflection",
      "purpose": "The learner has just taken in Renee's story — the 'office mom' framing, the daily comments, the team-chat bit, and Greg undercutting her in front of a client. The Coach steps in and asks for a gut reaction before working through the legal question, reading tone and starting assumptions to calibrate how Phase 1 is framed.",
      "input_placeholder": "Type what you’re thinking…",
      "opening_messages": [
        {
          "text": "Before we get into the specifics — take a moment. What’s your gut reaction to this behavior? Is anything about this situation standing out to you, or feeling unclear?"
        }
      ],
      "levels": {
        "neutral": {